id,title,score,url,num_comments,created,subreddit
nmonhr,Healthcare crisis in India,6633,https://i.redd.it/sx93kahn5s171.jpg,300,2021-05-28 08:55:26,india
1h26eic,Why I hate Narendra Modi,3516,https://www.reddit.com/r/india/comments/1h26eic/why_i_hate_narendra_modi/,904,2024-11-29 03:08:25,india
mst7hw,My uncle died this morning and I just want to vent.,3344,https://www.reddit.com/r/india/comments/mst7hw/my_uncle_died_this_morning_and_i_just_want_to_vent/,420,2021-04-17 21:22:17,india
17rdlfo,"Hi, r/India this is Dr. Abby Philips, a.k.a The Liver Doc, ready to take your questions on science, pseudoscience, healthcare myths, my journey as an AYUSH debunker, and basically everything that matters in health at the moment in India. I'm wearing my heart and mind on my sleeve today just for you.",3204,https://www.reddit.com/r/india/comments/17rdlfo/hi_rindia_this_is_dr_abby_philips_aka_the_liver/,1101,2023-11-09 19:31:56,india
12fajwp,Did you know that most corporate hospitals have been hiring Ayurveda and Homeopathic doctors as resident or duty doctors or even to manage ICUs at night,3157,https://www.reddit.com/r/india/comments/12fajwp/did_you_know_that_most_corporate_hospitals_have/,437,2023-04-08 09:22:56,india
1js8tr1,"I hate hate HATEE this country, India and my life here",3097,https://www.reddit.com/r/india/comments/1js8tr1/i_hate_hate_hatee_this_country_india_and_my_life/,760,2025-04-05 23:03:53,india
1ijmuxp,"Price of American dream: Gujarat family pays Rs 1 crore to reach US, deported to India",1807,https://www.moneycontrol.com/news/india/price-of-american-dream-gujarat-family-pays-rs-1-crore-to-reach-us-deported-to-india-12932264.html,241,2025-02-07 10:04:39,india
h04gab,Poor migrants workers not able to maintain 'social distancing' are not fools. They are helpless.,1762,https://www.reddit.com/r/india/comments/h04gab/poor_migrants_workers_not_able_to_maintain_social/,156,2020-06-10 10:52:52,india
1jo6y5y,"WTF, Why is Flying to Dubai Cheaper Than Flying to Assam?",1681,https://www.reddit.com/r/india/comments/1jo6y5y/wtf_why_is_flying_to_dubai_cheaper_than_flying_to/,146,2025-03-31 21:42:21,india
tjgmsg,Unpopular opinion: Hard work to achieve basic necessities of life should not be celebrated when the obvious thing is the failure of the system that fails to provide the person with basic necessities,1684,https://www.reddit.com/r/india/comments/tjgmsg/unpopular_opinion_hard_work_to_achieve_basic/,168,2022-03-21 22:37:09,india
1976t24,"Why do Indians not possess basic civic sense, specially when it comes to our own country",1672,https://www.reddit.com/r/india/comments/1976t24/why_do_indians_not_possess_basic_civic_sense/,284,2024-01-15 17:11:42,india
176ck3c,"A few days at hospital, taught me lessons for life.",1627,https://www.reddit.com/r/india/comments/176ck3c/a_few_days_at_hospital_taught_me_lessons_for_life/,85,2023-10-12 23:01:56,india
tgbu6x,Most of us middle class guys( without any generational wealth ) earning 40k-60k per month will never be financially independent in life,1537,https://www.reddit.com/r/india/comments/tgbu6x/most_of_us_middle_class_guys_without_any/,598,2022-03-17 20:14:40,india
14nj1yb,Moving back to India from Canada in the month of August.,1521,https://www.reddit.com/r/india/comments/14nj1yb/moving_back_to_india_from_canada_in_the_month_of/,591,2023-07-01 07:47:39,india
xw15br,I hate looking at my payslip,1350,https://www.reddit.com/r/india/comments/xw15br/i_hate_looking_at_my_payslip/,783,2022-10-05 10:28:40,india
